{
  "analysis_id": "COMP_20260402_091008_d4ab5f0c",
  "timestamp": "2026-04-02T15:10:08.457470+00:00",
  "status": "healthy",
  "source_trends": "TREND_20260402_090010_060aff9a",
  "analyses": [
    {
      "trend_title": "AI system learns to keep warehouse robot traffic running smoothly",
      "relevant_competitors": [
        {
          "name": "Fireship",
          "category": "developer",
          "likelihood": "high",
          "angle": "Code tutorial and implementation walkthrough"
        },
        {
          "name": "AI Explained",
          "category": "ai_deep_dive",
          "likelihood": "high",
          "angle": "Technical deep dive into architecture and implications"
        },
        {
          "name": "Two Minute Papers",
          "category": "ai_research",
          "likelihood": "high",
          "angle": "Paper review and research context"
        },
        {
          "name": "Yannic Kilcher",
          "category": "ai_research",
          "likelihood": "high",
          "angle": "Paper review and research context"
        },
        {
          "name": "sentdex",
          "category": "developer",
          "likelihood": "high",
          "angle": "Code tutorial and implementation walkthrough"
        }
      ],
      "coverage_angle": "Research paper analysis with visual explanations and implementation insights",
      "differentiation": [
        "Multi-modal presentation combining code, visuals, and narration",
        "Unique perspective from AI-powered content pipeline",
        "Real-time data integration and live demonstrations"
      ]
    },
    {
      "trend_title": "Cognichip wants AI to design the chips that power AI, and just raised $60M to try",
      "relevant_competitors": [
        {
          "name": "AI Explained",
          "category": "ai_deep_dive",
          "likelihood": "high",
          "angle": "Technical deep dive into architecture and implications"
        },
        {
          "name": "Matt Wolfe",
          "category": "ai_tools",
          "likelihood": "high",
          "angle": "Practical how-to guide for using related tools"
        },
        {
          "name": "Two Minute Papers",
          "category": "ai_research",
          "likelihood": "high",
          "angle": "Paper review and research context"
        },
        {
          "name": "The AI Advantage",
          "category": "ai_tools",
          "likelihood": "high",
          "angle": "Practical how-to guide for using related tools"
        },
        {
          "name": "Yannic Kilcher",
          "category": "ai_research",
          "likelihood": "high",
          "angle": "Paper review and research context"
        }
      ],
      "coverage_angle": "Technical breakdown with practical applications and code examples",
      "differentiation": [
        "Code-first implementation walkthrough",
        "Multi-modal presentation combining code, visuals, and narration",
        "Unique perspective from AI-powered content pipeline",
        "Real-time data integration and live demonstrations"
      ]
    },
    {
      "trend_title": "Mercor says it was hit by cyberattack tied to compromise of open source LiteLLM project",
      "relevant_competitors": [
        {
          "name": "AI Explained",
          "category": "ai_deep_dive",
          "likelihood": "high",
          "angle": "Technical deep dive into architecture and implications"
        },
        {
          "name": "Matt Wolfe",
          "category": "ai_tools",
          "likelihood": "high",
          "angle": "Practical how-to guide for using related tools"
        },
        {
          "name": "Two Minute Papers",
          "category": "ai_research",
          "likelihood": "high",
          "angle": "Paper review and research context"
        },
        {
          "name": "The AI Advantage",
          "category": "ai_tools",
          "likelihood": "high",
          "angle": "Practical how-to guide for using related tools"
        },
        {
          "name": "Yannic Kilcher",
          "category": "ai_research",
          "likelihood": "high",
          "angle": "Paper review and research context"
        }
      ],
      "coverage_angle": "Technical breakdown with practical applications and code examples",
      "differentiation": [
        "Code-first implementation walkthrough",
        "Multi-modal presentation combining code, visuals, and narration",
        "Unique perspective from AI-powered content pipeline",
        "Real-time data integration and live demonstrations"
      ]
    },
    {
      "trend_title": "Salesforce announces an AI-heavy makeover for Slack, with 30 new features",
      "relevant_competitors": [
        {
          "name": "AI Explained",
          "category": "ai_deep_dive",
          "likelihood": "high",
          "angle": "Technical deep dive into architecture and implications"
        },
        {
          "name": "Matt Wolfe",
          "category": "ai_tools",
          "likelihood": "high",
          "angle": "Practical how-to guide for using related tools"
        },
        {
          "name": "Two Minute Papers",
          "category": "ai_research",
          "likelihood": "high",
          "angle": "Paper review and research context"
        },
        {
          "name": "The AI Advantage",
          "category": "ai_tools",
          "likelihood": "high",
          "angle": "Practical how-to guide for using related tools"
        },
        {
          "name": "Yannic Kilcher",
          "category": "ai_research",
          "likelihood": "high",
          "angle": "Paper review and research context"
        }
      ],
      "coverage_angle": "Technical breakdown with practical applications and code examples",
      "differentiation": [
        "Code-first implementation walkthrough",
        "Multi-modal presentation combining code, visuals, and narration",
        "Unique perspective from AI-powered content pipeline",
        "Real-time data integration and live demonstrations"
      ]
    },
    {
      "trend_title": "OpenAI, not yet public, raises $3B from retail investors in monster $122B fund raise",
      "relevant_competitors": [
        {
          "name": "AI Explained",
          "category": "ai_deep_dive",
          "likelihood": "high",
          "angle": "Technical deep dive into architecture and implications"
        },
        {
          "name": "Matt Wolfe",
          "category": "ai_tools",
          "likelihood": "high",
          "angle": "Practical how-to guide for using related tools"
        },
        {
          "name": "Two Minute Papers",
          "category": "ai_research",
          "likelihood": "high",
          "angle": "Paper review and research context"
        },
        {
          "name": "The AI Advantage",
          "category": "ai_tools",
          "likelihood": "high",
          "angle": "Practical how-to guide for using related tools"
        },
        {
          "name": "Yannic Kilcher",
          "category": "ai_research",
          "likelihood": "high",
          "angle": "Paper review and research context"
        }
      ],
      "coverage_angle": "Technical breakdown with practical applications and code examples",
      "differentiation": [
        "Code-first implementation walkthrough",
        "Multi-modal presentation combining code, visuals, and narration",
        "Unique perspective from AI-powered content pipeline",
        "Real-time data integration and live demonstrations"
      ]
    }
  ],
  "meta": {
    "version": "1.0.0",
    "service": "competitor_analyzer",
    "story_id": "SKYBEAM-STORY-008",
    "analysis_count": 5,
    "degraded": false
  }
}